<?xml version="1.0" encoding="UTF-8"?>
<!DOCTYPE students SYSTEM "students.dtd">
<?xml-stylesheet type="text/xsl" href="students.xsl"?>
<students>
    <student>
        <roll>010</roll>
        <name>vikash</name>
        <email>Vikash@example.com</email>
        <mobile>+919199697225</mobile>
    </student>
    <student>
        <roll>010</roll>
        <name>vikash</name>
        <email>Vikash@example.com</email>
        <mobile>+919199697225</mobile>
    </student>
</students>