<?xml version ="1.0" encoding="UTF-8"?>
<?xml-stylesheet type="text/xsl" href="students.xsl"?>
<!DOCTYPE students SYSTEM "students.dtd">
<students>
    <student>
        <roll>101</roll>
        <name>Vikash</name>
        <email>Vikashkell@example.com</email>
        <mobile>9199697225</mobile>
    </student>
    <student>
        <roll>102</roll>
        <name>Priya</name>
        <email>priya@gmail.com</email>
        <mobile>9123456789</mobile>
    </student>
</students>